{
  "schema_version": 2,
  "kind": "dcc-cua-profile-package",
  "id": "shijie-qunchao",
  "version": "1.0.0",
  "display_name": "蚀界群潮",
  "description": "Reference profile for the internal real-time WASD game and its visual CUA acceptance loop.",
  "license": "MIT",
  "artifacts": [
    {"type": "semantic_profile", "path": "profile.json"},
    {"type": "agent_skill", "path": "SKILL.md"},
    {"type": "documentation", "path": "README.md"}
  ],
  "requires": {"dcc_cua": ">=0.6.0"},
  "platforms": ["windows"]
}
